{
  "$schema": "../schemas/mapping.schema.json",
  "record_type": "mapping_set",
  "mapping_set_id": "MAPSET-CC7",
  "name": "CC7 System Operations Relationship Set",
  "description": "Authoritative relationship graph for the CC7 vertical slice. Extends MAPSET-ACCESS-CORE and MAPSET-CC6 without repeating any edge already declared there. Edges are derived from the entity records, so convenience references and the graph cannot diverge.",
  "relationship_model": {
    "chain": [
      "criterion",
      "control",
      "evidence",
      "policy",
      "questionnaire",
      "finding",
      "remediation"
    ],
    "traversal_notes": [
      "CC7 reuses several CC6 entities rather than duplicating them: EV-CONFIG-001, EV-VULN-001, and EV-ENDPOINT-002 carry CC7 edges alongside their CC6 edges, and FND-NETSEC-002 and REM-NETSEC-002 were extended to CC7.1 rather than cloned.",
      "SOC2-CC7.1-001 predates this slice and its existing edges live in MAPSET-ACCESS-CORE; only its new relationships appear here.",
      "The relationship vocabulary is identical across all three sets and the validator enforces that identically-named types carry identical definitions."
    ]
  },
  "relationship_types": [
    {
      "type": "addresses_criterion",
      "from_entity": "control",
      "to_entity": "criterion",
      "inverse": "criterion_addressed_by",
      "cardinality": "many_to_many",
      "answers_question": "Which controls address this criterion?"
    },
    {
      "type": "supported_by_evidence",
      "from_entity": "control",
      "to_entity": "evidence",
      "inverse": "supports_control",
      "cardinality": "many_to_many",
      "answers_question": "Which evidence supports this control, and which controls does this evidence support?"
    },
    {
      "type": "documented_by_policy",
      "from_entity": "control",
      "to_entity": "policy",
      "inverse": "documents_control",
      "cardinality": "many_to_many",
      "answers_question": "Which policies support this control?"
    },
    {
      "type": "assessed_by_question",
      "from_entity": "control",
      "to_entity": "question",
      "inverse": "assesses_control",
      "cardinality": "many_to_many",
      "answers_question": "Which questionnaire questions relate to this control?"
    },
    {
      "type": "indicates_finding",
      "from_entity": "evidence",
      "to_entity": "finding",
      "inverse": "detected_by_evidence",
      "cardinality": "many_to_many",
      "answers_question": "What findings can this evidence reveal?"
    },
    {
      "type": "question_indicates_finding",
      "from_entity": "question",
      "to_entity": "finding",
      "inverse": "indicated_by_question",
      "cardinality": "many_to_many",
      "answers_question": "Which answers signal a potential gap?"
    },
    {
      "type": "finding_affects_control",
      "from_entity": "finding",
      "to_entity": "control",
      "inverse": "control_affected_by_finding",
      "cardinality": "many_to_many",
      "answers_question": "What findings can indicate a gap in this control?"
    },
    {
      "type": "finding_affects_criterion",
      "from_entity": "finding",
      "to_entity": "criterion",
      "inverse": "criterion_affected_by_finding",
      "cardinality": "many_to_many",
      "answers_question": "Which criteria are at risk from this finding?"
    },
    {
      "type": "remediated_by",
      "from_entity": "finding",
      "to_entity": "remediation",
      "inverse": "remediates",
      "cardinality": "many_to_many",
      "answers_question": "What remediation addresses this finding?"
    },
    {
      "type": "verified_by_evidence",
      "from_entity": "remediation",
      "to_entity": "evidence",
      "inverse": "verifies_remediation",
      "cardinality": "many_to_many",
      "answers_question": "How do we confirm the remediation actually landed?"
    }
  ],
  "mappings": [
    {
      "mapping_id": "MAP-0234",
      "from": {
        "entity_type": "control",
        "id": "SOC2-CC7.1-001"
      },
      "to": {
        "entity_type": "criterion",
        "id": "CC7.2"
      },
      "relationship": "addresses_criterion",
      "strength": "supporting",
      "confidence": "medium",
      "rationale": "Vulnerability Identification and Remediation contributes to CC7.2 in addition to its primary criterion CC7.1.",
      "sources": [
        "SRC-AICPA-TSC-2017-R2022"
      ],
      "status": "draft"
    },
    {
      "mapping_id": "MAP-0235",
      "from": {
        "entity_type": "control",
        "id": "SOC2-CC7.1-001"
      },
      "to": {
        "entity_type": "criterion",
        "id": "CC8.1"
      },
      "relationship": "addresses_criterion",
      "strength": "supporting",
      "confidence": "medium",
      "rationale": "Vulnerability Identification and Remediation contributes to CC8.1 in addition to its primary criterion CC7.1.",
      "sources": [
        "SRC-AICPA-TSC-2017-R2022"
      ],
      "status": "draft"
    },
    {
      "mapping_id": "MAP-0236",
      "from": {
        "entity_type": "control",
        "id": "SOC2-CC7.1-002"
      },
      "to": {
        "entity_type": "criterion",
        "id": "CC7.1"
      },
      "relationship": "addresses_criterion",
      "strength": "primary",
      "confidence": "high",
      "rationale": "Configuration Baseline Monitoring and Change Detection is DriftGuard's primary control articulation for CC7.1: Detect changes to system configuration that introduce new vulnerability or weaken an existing control, rather than discovering them at review time or during an examination.",
      "sources": [
        "SRC-AICPA-TSC-2017-R2022"
      ],
      "status": "draft"
    },
    {
      "mapping_id": "MAP-0237",
      "from": {
        "entity_type": "control",
        "id": "SOC2-CC7.1-002"
      },
      "to": {
        "entity_type": "criterion",
        "id": "CC7.2"
      },
      "relationship": "addresses_criterion",
      "strength": "supporting",
      "confidence": "medium",
      "rationale": "Configuration Baseline Monitoring and Change Detection contributes to CC7.2 in addition to its primary criterion CC7.1.",
      "sources": [
        "SRC-AICPA-TSC-2017-R2022"
      ],
      "status": "draft"
    },
    {
      "mapping_id": "MAP-0238",
      "from": {
        "entity_type": "control",
        "id": "SOC2-CC7.1-002"
      },
      "to": {
        "entity_type": "criterion",
        "id": "CC8.1"
      },
      "relationship": "addresses_criterion",
      "strength": "supporting",
      "confidence": "medium",
      "rationale": "Configuration Baseline Monitoring and Change Detection contributes to CC8.1 in addition to its primary criterion CC7.1.",
      "sources": [
        "SRC-AICPA-TSC-2017-R2022"
      ],
      "status": "draft"
    },
    {
      "mapping_id": "MAP-0239",
      "from": {
        "entity_type": "control",
        "id": "SOC2-CC7.1-002"
      },
      "to": {
        "entity_type": "evidence",
        "id": "EV-CONFIG-001"
      },
      "relationship": "supported_by_evidence",
      "strength": "primary",
      "confidence": "high",
      "rationale": "Configuration Change History and Drift Record is primary evidence for Configuration Baseline Monitoring and Change Detection: Change history and drift record across the period.",
      "sources": [
        "SRC-DG-AUDITOR-PRACTICE"
      ],
      "status": "draft"
    },
    {
      "mapping_id": "MAP-0240",
      "from": {
        "entity_type": "control",
        "id": "SOC2-CC7.1-002"
      },
      "to": {
        "entity_type": "evidence",
        "id": "EV-VULN-001"
      },
      "relationship": "supported_by_evidence",
      "strength": "supporting",
      "confidence": "medium",
      "rationale": "Vulnerability Scan Result and Remediation Tracking is supporting evidence for Configuration Baseline Monitoring and Change Detection: Scan results corroborate whether configuration change introduced known vulnerability.",
      "sources": [
        "SRC-DG-AUDITOR-PRACTICE"
      ],
      "status": "draft"
    },
    {
      "mapping_id": "MAP-0241",
      "from": {
        "entity_type": "control",
        "id": "SOC2-CC7.1-002"
      },
      "to": {
        "entity_type": "policy",
        "id": "POL-NETSEC-001"
      },
      "relationship": "documented_by_policy",
      "strength": "primary",
      "confidence": "high",
      "rationale": "Network and Boundary Security Policy is where the standard Configuration Baseline Monitoring and Change Detection is measured against originates.",
      "sources": [
        "SRC-DG-BEST-PRACTICE"
      ],
      "status": "draft"
    },
    {
      "mapping_id": "MAP-0242",
      "from": {
        "entity_type": "control",
        "id": "SOC2-CC7.1-002"
      },
      "to": {
        "entity_type": "policy",
        "id": "POL-VULN-001"
      },
      "relationship": "documented_by_policy",
      "strength": "primary",
      "confidence": "high",
      "rationale": "Vulnerability Management Policy is where the standard Configuration Baseline Monitoring and Change Detection is measured against originates.",
      "sources": [
        "SRC-DG-BEST-PRACTICE"
      ],
      "status": "draft"
    },
    {
      "mapping_id": "MAP-0243",
      "from": {
        "entity_type": "control",
        "id": "SOC2-CC7.1-002"
      },
      "to": {
        "entity_type": "question",
        "id": "QN-OPS-001-Q01"
      },
      "relationship": "assessed_by_question",
      "strength": "primary",
      "confidence": "high",
      "rationale": "Assesses Configuration Baseline Monitoring and Change Detection. Question intent: Establish whether change detection is continuous or review-based, and whether advisory monitoring exists separately from scheduled scanning.",
      "sources": [
        "SRC-DG-BEST-PRACTICE"
      ],
      "status": "draft"
    },
    {
      "mapping_id": "MAP-0244",
      "from": {
        "entity_type": "control",